"Status","Start Time","Stop Time","Duration in ms","Parent Suite","Suite","Sub Suite","Test Class","Test Method","Name","Description"
"passed","Tue Apr 25 13:28:45 GMT 2023","Tue Apr 25 13:28:46 GMT 2023","538","example to-do app","with a checked task","","","","can delete all completed tasks",""
"passed","Tue Apr 25 13:28:41 GMT 2023","Tue Apr 25 13:28:42 GMT 2023","1602","","example to-do app","","","","displays two todo items by default",""
"passed","Tue Apr 25 13:28:43 GMT 2023","Tue Apr 25 13:28:44 GMT 2023","489","","example to-do app","","","","can check off an item as completed",""
"passed","Tue Apr 25 13:28:45 GMT 2023","Tue Apr 25 13:28:45 GMT 2023","605","example to-do app","with a checked task","","","","can filter for completed tasks",""
"passed","Tue Apr 25 13:28:43 GMT 2023","Tue Apr 25 13:28:43 GMT 2023","918","","example to-do app","","","","can add new todo items",""
"passed","Tue Apr 25 13:28:44 GMT 2023","Tue Apr 25 13:28:45 GMT 2023","638","example to-do app","with a checked task","","","","can filter for uncompleted tasks",""
