"Status","Start Time","Stop Time","Duration in ms","Parent Suite","Suite","Sub Suite","Test Class","Test Method","Name","Description"
"passed","Wed May 04 09:54:04 GMT 2022","Wed May 04 09:54:04 GMT 2022","609","example to-do app","with a checked task","","","","can delete all completed tasks",""
"passed","Wed May 04 09:54:02 GMT 2022","Wed May 04 09:54:03 GMT 2022","540","","example to-do app","","","","can check off an item as completed",""
"passed","Wed May 04 09:54:03 GMT 2022","Wed May 04 09:54:04 GMT 2022","542","example to-do app","with a checked task","","","","can filter for completed tasks",""
"passed","Wed May 04 09:54:01 GMT 2022","Wed May 04 09:54:02 GMT 2022","776","","example to-do app","","","","can add new todo items",""
"passed","Wed May 04 09:54:03 GMT 2022","Wed May 04 09:54:03 GMT 2022","600","example to-do app","with a checked task","","","","can filter for uncompleted tasks",""
"passed","Wed May 04 09:54:00 GMT 2022","Wed May 04 09:54:01 GMT 2022","1520","","example to-do app","","","","displays two todo items by default",""
