"Status","Start Time","Stop Time","Duration in ms","Parent Suite","Suite","Sub Suite","Test Class","Test Method","Name","Description"
"passed","Mon Jul 18 15:46:55 GMT 2022","Mon Jul 18 15:46:56 GMT 2022","677","example to-do app","with a checked task","","","","can filter for completed tasks",""
"passed","Mon Jul 18 15:46:52 GMT 2022","Mon Jul 18 15:46:53 GMT 2022","1140","","example to-do app","","","","displays two todo items by default",""
"passed","Mon Jul 18 15:46:53 GMT 2022","Mon Jul 18 15:46:54 GMT 2022","899","","example to-do app","","","","can add new todo items",""
"passed","Mon Jul 18 15:46:54 GMT 2022","Mon Jul 18 15:46:55 GMT 2022","462","","example to-do app","","","","can check off an item as completed",""
"passed","Mon Jul 18 15:46:55 GMT 2022","Mon Jul 18 15:46:55 GMT 2022","714","example to-do app","with a checked task","","","","can filter for uncompleted tasks",""
"passed","Mon Jul 18 15:46:56 GMT 2022","Mon Jul 18 15:46:57 GMT 2022","628","example to-do app","with a checked task","","","","can delete all completed tasks",""
